"Status","Start Time","Stop Time","Duration in ms","Parent Suite","Suite","Sub Suite","Test Class","Test Method","Name","Description"
"failed","Mon Dec 05 18:21:39 CET 2022","Mon Dec 05 18:22:05 CET 2022","25486","","Creating a new page","","","","Creates a new page",""
"passed","Mon Dec 05 18:22:15 CET 2022","Mon Dec 05 18:22:18 CET 2022","3361","","Create a document with an already existing title","","","","Tests the duplicate document error",""
"passed","Mon Dec 05 18:22:48 CET 2022","Mon Dec 05 18:22:51 CET 2022","3108","","Search for a document","","","","Click on the search bar and search for a document",""
"passed","Mon Dec 05 18:22:27 CET 2022","Mon Dec 05 18:22:30 CET 2022","3138","","Open a random page","","","","Clicks on the Random Page button",""
"passed","Mon Dec 05 18:21:25 CET 2022","Mon Dec 05 18:21:27 CET 2022","2350","","Open a page from the All Pages list","","","","Click on a page on the home page",""
